<?xml version="1.0" encoding="UTF-8"?>
<cv24:cv24 xmlns:cv24="http://univ.fr/cv24" xmlns:xsi="http://www.w3.org/2001/XMLSchema-instance" xsi:schemaLocation="http://univ.fr/cv24 shema.xsd ">
    <cv24:identite>
        <cv24:genre>Mme</cv24:genre>
        <cv24:nom>ABBAS</cv24:nom>
        <cv24:prenom>Melissa</cv24:prenom>
        <cv24:tel>+33 6 12 34 56 78</cv24:tel>
        <cv24:mel>A.meli@example.com</cv24:mel>
    </cv24:identite>
    <cv24:objectif statut="emploi">Développeuse full stack</cv24:objectif>
    <cv24:prof>
        <cv24:detail>
            <cv24:datedeb>2015-01-01</cv24:datedeb>
            <cv24:datefin>2020-12-31</cv24:datefin>
            <cv24:titre>Ingénieur logiciel</cv24:titre>
        </cv24:detail>
        <cv24:detail>
            <cv24:datedeb>2021-01-01</cv24:datedeb>
            <cv24:datefin>2023-06-30</cv24:datefin>
            <cv24:titre>Chef de projet</cv24:titre>
        </cv24:detail>
        <cv24:detail>
            <cv24:datedeb>2023-07-01</cv24:datedeb>
            <cv24:datefin>2024-12-31</cv24:datefin>
            <cv24:titre>Architecte logiciel</cv24:titre>
        </cv24:detail>
    </cv24:prof>
    <cv24:competences>
        <cv24:diplome intitule="Licence" niveau="7">
            <cv24:date>2014-07-01</cv24:date>
            <cv24:institut>Université de Paris</cv24:institut>
            <cv24:titreD>Licence Informatique</cv24:titreD>
        </cv24:diplome>
        <cv24:diplome intitule="Master" niveau="2">
            <cv24:date>2016-09-01</cv24:date>
            <cv24:institut>École Polytechnique</cv24:institut>
            <cv24:titreD>Master Informatique</cv24:titreD>
        </cv24:diplome>
        <cv24:certif>
            <cv24:datedeb>2022-03-01</cv24:datedeb>
            <cv24:datefin>2022-05-01</cv24:datefin>
            <cv24:titre>Agile Scrum Master</cv24:titre>
        </cv24:certif>
        <cv24:certif>
            <cv24:datedeb>2023-05-01</cv24:datedeb>
            <cv24:datefin>2023-10-01</cv24:datefin>
            <cv24:titre>CCNA Cisco Certified</cv24:titre>
        </cv24:certif>
    </cv24:competences>
    <cv24:divers>
        <cv24:lv cert="TOEIC" lang="EN" nivs="C1" />
        <cv24:lv cert="CLES" lang="Fr" nivs="C2" />
        <cv24:autre titre="Permis de conduire" comment="B" />
    </cv24:divers>
</cv24:cv24>
