<?xml version="1.0" encoding="UTF-8"?>
<cv24:cv24 xmlns:cv24="http://univ.fr/cv24" xmlns:xsi="http://www.w3.org/2001/XMLSchema-instance" xsi:schemaLocation="http://univ.fr/cv24 shema.xsd ">
    <cv24:identite>
        <cv24:genre>Mme</cv24:genre>
        <cv24:nom>DUBOIS</cv24:nom>
        <cv24:prenom>Ilina</cv24:prenom>
        <cv24:tel>+33 7 75 48 23 45</cv24:tel>
        <cv24:mel>exempl@gmail.com</cv24:mel>
    </cv24:identite>
    <cv24:objectif statut="emploi">INFFFF</cv24:objectif>
    <cv24:prof>
        <cv24:detail>
            <cv24:datedeb>2001-01-01</cv24:datedeb>
            <cv24:datefin>2001-01-01</cv24:datefin>
            <cv24:titre>Directrice Adjoint</cv24:titre>
        </cv24:detail>
        <cv24:detail>
            <cv24:datedeb>2001-01-01</cv24:datedeb>
            <cv24:datefin>2001-01-01</cv24:datefin>
            <cv24:titre>Chef de projet</cv24:titre>
        </cv24:detail>
        <cv24:detail>
            <cv24:datedeb>2001-01-01</cv24:datedeb>
            <cv24:datefin>2001-01-01</cv24:datefin>
            <cv24:titre>dev ops</cv24:titre>
        </cv24:detail>
    </cv24:prof>
    <cv24:competences>
        <cv24:diplome intitule="Licence" niveau="7">
            <cv24:date>2018-07-11</cv24:date>
            <cv24:institut>Université DE BÉJAIA </cv24:institut>
            <cv24:titreD>Licence Informatique</cv24:titreD>
        </cv24:diplome>
        <cv24:diplome intitule="Bac" niveau="1">
            <cv24:date>2018-01-01</cv24:date>
            <cv24:institut>Lycée Taos amrouche</cv24:institut>
            <cv24:titreD>Bac SE</cv24:titreD>
        </cv24:diplome>
        <cv24:diplome intitule="Master" niveau="2">
            <cv24:date>2018-09-11</cv24:date>
            <cv24:institut>Université DE BÉJAIA </cv24:institut>
            <cv24:titreD> Master GL</cv24:titreD>
        </cv24:diplome>

        <cv24:certif>
            <cv24:datedeb>1990-03-01</cv24:datedeb>
            <cv24:datefin>1990-05-01</cv24:datefin>
            <cv24:titre>agile scrum</cv24:titre>
        </cv24:certif>
        <cv24:certif>
            <cv24:datedeb>2022-05-01</cv24:datedeb>
            <cv24:datefin>2022-10-01</cv24:datefin>
            <cv24:titre>CCNA CISCO</cv24:titre>
        </cv24:certif>
    </cv24:competences>
    <cv24:divers>
        <cv24:lv cert="MAT" lang="fr" />
        <cv24:lv cert="CLES" lang="Fr" nivs="C1" />
        <cv24:lv cert="TOEIC" lang="EN" nivi="250" />
        <cv24:autre titre="permis de conduire" comment="B" />
    </cv24:divers>
</cv24:cv24>


